Thématique;Date;Nom;Objectifs;Localisation
Transversal;2019-04-01;Réaménagement BX35;"Achat de mobilier et 
travaux de peinture";40 rue de pelvoux, 91000 evry-courcouronnes
Transversal;2019-04-01;"Baby-foot 
Facteur Cheval";Achat d'un baby-foot;Rue du facteur Cheval,  91000 evry-courcouronnes
Transversal;2019-04-01;Street workout IBGBI;Achat et installations de structures de streetworkout;23 Boulevard de France, 91000 evry-courcouronnes
Transversal;2019-04-01;Journée sensibilisation au handicap;"Organisation de concerts, 
expo, ateliers";23 boulevard Francois Mitterrand, 91000 evry-courcouronnes
Transversal;2019-11-01;Epicerie solidaire;Aménagement d'un local et achat de matériel;
Transversal;2019-11-01;Installations bancs;Installation bancs;
Transversal;2019-11-01;"Formation des 
associations";Création d'un catalogue de formations destinées aux associations étudiantes;
Transversal;2019-06-01;Aménagement IUT Juvisy;Création d'un espace convivial;
Transversal;2019-06-01;Remorque food;Aquisition d'une remorque food;
Culture;2019-04-01;"Etre humain, 
vivre ensemble";"Exposition sur le thème des inégalités 
à la BU";
Culture;2019-12-12;"Nocturnes de l'histoire  : 
à la lumière d'une vie";Conférence et table ronde;
Culture;2019-12-12;Journée Hommage à Amadou Hampaté Ba;Débat et table-ronde , exposition, animation musicale;
Sport;2019-04-01;Escalade;Entrées salle escalade;
Sport;2019-04-01;Tournoi des lumières;Tournoi de filière sur 5 activités sportives;
Transversal;2020-11-01;Aménagement du local de l'épicerie solidaire;Achat de matériel de cuisine pour équiper l'épicerie solidaire.;
Culture;2020-11-01;Ciné-concert Keaton Chaplin;Projection de deux grands classiques du film muet sous la forme de ciné-concert;
Transversal;2019-04-01;Pack association;"Achat de matériel 
audiovisuel";
Transversal;2019-04-01;Street workout BU;Achat et installations de structures de streetworkout;Rue du Père André Jarlan, 91000 evry-courcouronnes
Transversal;2019-11-01;Bien vivre en GTE;Aménagement d'un espace de convivialité;
Transversal;2019-11-01;Range vélos;Installation de range vélos;
Culture;2019-04-01;Exposition photo;Exposition photo sur la vie de campus à l'occasion de l'inauguration de la galerie Cesaria Evora;
Culture;2019-04-01;"Chanter au cœur
 de l'Université";Organisation d'un chœur d'étudiants et personnels de l'Université;
Culture;2019-04-01;Nos météores;Exposition;
Culture;2019-04-01;Akousmaflore;Exposition d'une production de Scenoscome;
Culture;2019-12-12;Concert des Chœurs;Organisation d'un concert en Grèce;
Culture;2019-12-12;Wanderlust : l'art total de Bjork;Concert autour d'œuvres de Bjork, exposition BU et projection film;
Culture;2019-12-12;"Exposition photo autour
de la thématique H/F";Exposition photo;
Sport;2019-04-01;Tournoi futsal;Réalisation tournoi de futsal;
Sport;2019-04-01;Drone;Achat d'un drone;
Sport;2019-04-01;Barnum;Achat de barnum pour différents évènements sportifs;
Sport;2019-04-01;Cross fit;Activité sport campus;
Sport;2020-03-01;Recrutement étudiant promotion et gestion homeball et streetworkout;Recrutement d'un étudiant pour la gestion et promotion de structures sportives;
Sport;2020-03-01;"Campusiades version 
confinée";;
Sport;2020-03-01;Barnum 2020;Achat de barnum pour différents évènements sportifs;
Santé;2019-04-01;L'alimentation plaisir santé;"Mise en place d'ateliers et
consultations";
Santé;2019-04-01;Achat d'un défibrillateur;"Installation de matériel au
 SUMPPS";
Santé;2020-06-01;"Prévention du tabagisme et autres 
produits fumés";Programme de lutte contre les addictions aux produits fumés;
Transversal;2020-11-01;Parking vélo;Installation de deux abris adaptés et sécurisés pour les vélos.;
Culture;2020-11-01;Bulles sociologiques;Publication d’une BD par et pour les étudiants de l’Université d’Évry;
Culture;2020-11-01;Valorisation du patrimoine de Amadou HAMPATE BA;Hommage à Amadou Hampate Ba;
Transversal;2019-11-01;Aménagement local UNEF;Installation de mobilier;
Transversal;2019-11-01;Expo hall 1ers cycles;Installation de matériel d'exposition;
Transversal;2019-11-01;Aménagement hall 1ers cycles;Installation de micro ondes et banquettes;
Transversal;2019-11-01;Prescri forme;Programme de prescription d'activité physique;
Transversal;2019-06-01;Micro-ondes;Installation de micro ondes sur tous les sites;
Culture;2019-04-01;Salle culturelle;"Création et aménagement 
de la galerie Cesaria Evora";
Culture;2019-04-01;Orchestre universitaire;Organisation d'un orchestre d'étudiants et personnels de l'Université;
Culture;2019-04-01;A vos baskets les filles;Présentation d'un spectacle;
Culture;2019-12-12;"Nos météores II -
Fictions atmosphériques";Exposition;
Culture;2019-12-12;Ressusciter les rivières;Réalisation d'un documentaire;
Culture;2019-12-12;"No woman No cry :
l'art de réparer les femmes";Conférence;
Culture;2019-12-12;Les célèbres chuchoteurs;Spectacle à la BU;
Sport;2019-04-01;Homeball;Achat de structures pour jeux de balle;
Sport;2019-04-01;Tests de condition physique;"Passation de test de condition physique
pour les étudiants primo entrants";
Sport;2020-03-01;"Recrutement étudiant
""CVEC sport campus""";Recrutement d'un étudiant pour la gestion des activités CVEC sport campus;
Sport;2020-03-01;Kelform 2020;Progamme de passation de test de condition physique;
Santé;2019-04-01;"Distributeur de protections
 hygiéniques";Installation de distributeurs de protections hygiéniques gratuites;
Santé;2019-04-01;Achat d'une armoire électrique  et d'un enregistreur radiofréquence;"Installation de matériel 
au SUMPPS";
Santé;2020-03-01;Ateliers nutrition;Mise en place d'ateliers en ligne;
Santé;2020-06-01;Stress des étudiants;Prise en charge médicalisée;
Culture;2020-11-01;Apprendre de l'autre;Ateliers d'écriture et déambulations de comédiens sur le campus;
Culture;2020-11-01;Homogenitus;Exposition démonstration et performances;
Culture;2020-11-01;La ligne rouge;Projet de performance interactive portant sur la thématique de la surveillance et l'automatisation;
Culture;2020-11-01;Azawan Jazz et chaâbi Concert action culturelle et pédagogique;Concert;
